anime_id,name,genre,type,episodes,rating,members
6747,dance in the vampire bund,"action, supernatural, vampire",tv,12,7.2,121005
2669,doraemon movie 06 nobita no little star wars,"fantasy, space",movie,1,7.2,1059
2678,doraemon movie 18 nobita no nejimaki city boukenki,"adventure, fantasy, kids, shounen",movie,1,7.2,896
15159,fantastic children special,slice of life,special,1,7.2,873
9367,freezing,"action, drama, ecchi, harem, martial arts, romance, sci-fi, seinen",tv,12,7.2,159273
10115,friends mononoke shima no naki,"comedy, fantasy, kids",movie,1,7.19,601
30290,fwhamatora,"comedy, mystery, super power",movie,1,7.2,3718
15811,girls und panzer specials,"military, school",special,6,7.2,15228
729,hiatari ryoukou,"comedy, romance, school, sports",tv,48,7.2,1527
4549,hokuto no ken raoh gaiden ten no haoh,"action, drama, martial arts",tv,13,7.2,6659
1336,kyoushoku soukou guyver ii,"action, adventure, drama, horror, sci-fi",ova,6,7.2,4876
4851,lupin iii seven days rhapsody,"action, adventure, comedy, shounen",special,1,7.2,2482
16890,makai ouji devils and realist,"comedy, demons, fantasy, historical, mystery, school, shoujo, supernatural",tv,12,7.2,59819
23227,mikakunin de shinkoukei kamoniku tte midorippoi aji ga suru no ne,"comedy, romance, seinen, slice of life",ova,1,7.2,21717
24171,mushibugyou ova,"action, fantasy, historical, martial arts, samurai, shounen, super power",ova,3,7.2,3636
3752,nagagutsu wo haita neko 80 nichikan sekai isshuu,"adventure, kids",movie,1,7.2,925
4662,neo angelique abyss second age,"adventure, fantasy, harem, shoujo",tv,13,7.2,12975
2490,one piece mezase kaizoku yakyuu ou,"comedy, fantasy, shounen, sports",movie,1,7.2,20054
1564,pokemon advanced generation,"action, adventure, comedy, fantasy, kids",tv,192,7.2,67386
592,popolocrois,"adventure, fantasy",tv,26,7.2,1065
31919,pripara movie minna no akogare lets goprix paris,"music, school, shoujo, slice of life",movie,1,7.2,502
32094,reikenzan hoshikuzutachi no utage,"comedy, fantasy, magic",tv,12,7.2,30153
20047,sakura trick,"comedy, romance, school, seinen, shoujo ai, slice of life",tv,12,7.2,108011
478,sousei no aquarion,"action, mecha, romance, sci-fi, super power, supernatural",tv,26,7.2,46647
2452,space adventure cobra,"action, adventure, sci-fi, space",movie,1,7.2,3586
8986,supernatural the animation,"action, demons, horror, supernatural",ova,22,7.2,18528
23587,the idolmster cinderella girls,"comedy, drama, music",tv,13,7.2,33042
20035,toaru majutsu no index endymion no kiseki special,"action, magic, sci-fi, super power",special,1,7.2,11241
1555,tokimeki memorial only love,"comedy, harem, romance, school",tv,25,7.2,24691
2331,uchuu densetsu ulysses 31,"action, adventure, sci-fi, space",tv,26,7.2,2297
3446,biohazard degeneration,"action, horror, sci-fi",movie,1,7.19,20172
568,bubblegum crisis tokyo 2040,"adventure, mecha, sci-fi, shounen",tv,26,7.19,20079
831,chicchana yukitsukai sugar,"comedy, fantasy, slice of life",tv,24,7.19,14955
2354,devilman tanjouhen,"demons, horror, sci-fi, supernatural",ova,1,7.19,7171
1796,dirty pair the movie,"adventure, comedy, police, sci-fi",movie,1,7.19,3227
393,escaflowne,"adventure, drama, fantasy, mecha, romance, sci-fi, shoujo",movie,1,7.19,37379
6959,ga geijutsuka art design class ova,"comedy, school, seinen, slice of life",ova,1,7.19,3284
28539,garo movie divine flame,"action, demons, fantasy, magic, supernatural",movie,1,7.18,7179
3447,ghost in the shell stand alone complex  solid state society  uchikoma no hibi,"comedy, mecha, sci-fi",special,1,7.19,8937
23619,haiyore nyarukosan w ova,"comedy, ecchi, parody",ova,1,7.19,14585
2998,hi no tori uchuuhen,"drama, fantasy, sci-fi",ova,1,7.19,1158
6909,jungle taitei yuuki ga mirai wo kaeru,adventure,special,1,7.19,1163
1864,koisuru tenshi angelique kagayaki no ashita,"drama, fantasy, harem, romance, shoujo",tv,12,7.19,5827
1261,kyattou ninden teyandee,"action, comedy, mecha, sci-fi, shounen, super power",tv,54,7.19,7112
149,loveless,"action, drama, fantasy, mystery, romance, shoujo, shounen ai, supernatural",tv,12,7.19,85554
33299,magickyun renaissance,"magic, music, romance, school",tv,13,7.19,12095
2931,mokke,"mystery, slice of life, supernatural",tv,24,7.19,8362
30016,nanbaka,"action, comedy, drama",tv,13,7.19,57325
350,ojamajo doremi,"comedy, magic",tv,51,7.19,19222
6324,omamori himari,"action, comedy, demons, ecchi, harem, romance, supernatural",tv,12,7.19,119572
5279,sekirei hajimete no otsukai,comedy,special,1,7.19,32430
12709,tales of symphonia the animation sekai tougouhen specials,comedy,special,3,7.19,3692
7144,uchuu senkan yamato fukkatsuhen,"action, adventure, drama, military, space",movie,1,7.19,2005
3614,yakushiji ryouko no kaiki jikenbo,"mystery, police, supernatural",tv,13,7.19,11002
754,yuki no joou,"adventure, drama, fantasy",tv,36,7.19,2228
26165,yuri kuma arashi,"drama, fantasy, psychological, school, seinen, shoujo ai",tv,12,7.19,48549
3354,zombieloan specials,"action, shounen, supernatural",special,2,7.19,22182
493,armitage iii polymatrix,"action, adventure, mecha, military, police, romance, sci-fi",movie,1,7.18,9186
7817,b gata h kei,"comedy, ecchi, romance, school, seinen",tv,12,7.18,192719
33080,brotherhood final fantasy xv,action,ona,5,7.18,29445
5032,cobra the animation,"action, adventure, sci-fi, space",tv,13,7.18,4361
2907,cyborg kurochan,"comedy, sci-fi",tv,66,7.18,3188
2651,doraemon doraemon comes back movie,"comedy, fantasy, kids",movie,1,7.18,672
5197,dragon league,"adventure, comedy, fantasy, shounen, sports",tv,39,7.18,558
32801,dungeon ni deai wo motomeru no wa machigatteiru darou ka ova,"action, adventure, comedy, fantasy, romance",ova,1,7.18,23370
26057,fatekaleid liner prismaillya 2wei ova,"comedy, ecchi, fantasy, magic",ova,1,7.18,14351
1829,gedo senki,"adventure, fantasy, magic",movie,1,7.18,59243
6867,halo legends,"action, drama, military, sci-fi",ona,9,7.18,21190
23083,happiness charge precure movie ningyou no kuni no ballerina,"fantasy, kids, magic, shoujo",movie,1,7.18,1332
247,harukanaru toki no naka de hachiyou shou,"demons, fantasy, historical, magic, shoujo, supernatural",tv,26,7.18,14550
8206,hime chen otogi chikku idol lilpri,"magic, shoujo",tv,51,7.18,6118
3027,hokuto no ken yuriaden,"action, adventure, drama, martial arts",ova,1,7.18,3713
606,kazemakase tsukikage ran,"adventure, comedy, historical, martial arts, samurai",tv,13,7.18,7893
2077,kindaichi shounen no jikenbo,"mystery, school, shounen",movie,1,7.18,1641
2797,koukou tekkenden tough,"action, martial arts, shounen",ova,3,7.18,2398
6379,kyou no 5 no 2 tv takarabako,"comedy, ecchi, school, seinen",ova,1,7.18,5553
7066,mahoromatic im home,"comedy, ecchi, romance, sci-fi",special,2,7.18,5760
604,mahou no stage fancy lala,"comedy, drama, magic, music, romance, shoujo",tv,26,7.18,5991
2044,mahou no tenshi creamy mami,"comedy, fantasy, magic, romance, school, sci-fi, shoujo",tv,52,7.18,5112
5030,mariaholic,"comedy, parody, school, shoujo ai",tv,12,7.18,104663
1110,mermaid melody pichi pichi pitch pure,"adventure, comedy, magic, romance, shoujo",tv,39,7.18,19311
2279,nagagutsu wo haita neko,"adventure, fantasy, kids",movie,1,7.18,1804
3059,ninja senshi tobikage,"adventure, mecha, sci-fi, shounen, space",tv,43,7.18,1941
1199,nintama rantarou,"comedy, shounen",tv,2,7.18,2255
32603,okusama ga seitokaichou,"comedy, ecchi, romance, school, shounen",tv,12,7.17,37570
461,one piece movie 3 chinjuujima no chopper oukoku,"action, adventure, comedy, fantasy, shounen, super power",movie,1,7.18,36558
1569,otome wa boku ni koishiteru,"comedy, drama, romance, school",tv,12,7.18,42190
11009,pokemon 3d adventure 2 pikachu no kaitei daibouken,"adventure, comedy, fantasy, kids",movie,1,7.18,5158
34514,pokemon generations,"action, adventure, fantasy, game, kids",ona,18,7.21,295
2369,rental magica,"fantasy, mystery, supernatural",tv,24,7.18,39806
20973,sekai seifuku bouryaku no zvezda,"action, comedy, fantasy",tv,12,7.18,67877
938,shin getter robo tai neo getter robo,"action, mecha, sci-fi, shounen",ova,4,7.18,2339
3138,solty rei special,"comedy, drama",special,1,7.18,2641
6098,sora no manimani,"comedy, romance, school, slice of life",tv,12,7.18,28652
10351,tenchi muyou ryououki 2nd season picture drama,"comedy, sci-fi, shounen, space",special,1,7.18,3626
448,tenjou tenge the ultimate fight,"adventure, drama, martial arts, romance, shounen, supernatural",ova,2,7.18,29039
7654,tokyo magnitude 80 recap,drama,special,1,7.18,4257
2470,uchuu kaizoku captain harlock arcadiagou no nazo,"action, adventure, drama, sci-fi, space",movie,1,7.18,2579
21439,uta noprincesama maji love revolutions,"comedy, harem, music, romance, school, shoujo",tv,13,7.18,27997
3486,yuusha tokkyuu might gaine,"action, adventure, mecha, sci-fi, shounen",tv,47,7.18,1021
32717,aikatsu stars,"music, school, shoujo, slice of life",tv,2,7.17,4485
31080,anne happy,"comedy, school, slice of life",tv,12,7.17,32040
284,area 88 tv,"action, drama, military, romance, shounen",tv,12,7.17,7563
286,bt x,"adventure, mecha, sci-fi, shounen",tv,25,7.17,5913
23237,chuunibyou demo koi ga shitai ren specials,comedy,special,7,7.17,20337
6217,crayon shinchan movie 03 unkokusai no yabou,"comedy, ecchi, kids, school, shounen, slice of life",movie,1,7.17,1617
992,dual parallel trouble adventures,"action, comedy, harem, mecha, sci-fi, shounen",tv,13,7.17,10636
19067,future card buddyfight,game,tv,64,7.17,3417
2815,geragera boes monogatari,"comedy, kids",tv,52,7.17,869
2132,inukami the movie tokumei reiteki sousakan karina shirou,"comedy, ecchi, magic, romance, supernatural",movie,1,7.17,13115
5978,kannagi moshimo kannagi ga attara,"comedy, school, shounen, supernatural",special,1,7.17,22155
3110,kaze no naka no shoujo kinpatsu no jeanie,"drama, historical",tv,52,7.17,1414
17741,kimi no iru machi,"drama, romance, slice of life",tv,12,7.17,63418
1436,lupin iii twilight gemini no himitsu,"action, adventure, comedy, shounen",special,1,7.17,3493
252,madlax,"drama, magic, military, mystery, psychological, shounen, supernatural",tv,26,7.17,25995
10690,magic tree house,"adventure, magic",movie,1,7.17,3433
4997,mahoromatic 2 end year special,"comedy, ecchi, military, romance, sci-fi",special,1,7.17,4236
33003,mahou shoujo ikusei keikaku,"action, fantasy, supernatural, thriller",tv,12,7.17,46024
442,naruto movie 1 dai katsugeki yuki hime shinobu houjou dattebayo,"adventure, comedy, drama, historical, shounen, supernatural",movie,1,7.17,120571
31404,netoge no yome wa onnanoko ja nai to omotta,"comedy, ecchi, game, romance, school",tv,12,7.17,137102
10302,pokemon diamond and pearl specials,"action, comedy, fantasy, kids",special,2,7.17,5913
11569,precure all stars dx the dance live miracle dance stage e youkoso,"fantasy, magic, music, shoujo",ova,1,7.17,1057
33713,seihou bukyou outlaw star specials,"action, adventure, comedy, ecchi, sci-fi",special,2,7.16,1509
17391,senyuu specials,"action, comedy, fantasy, shounen",special,4,7.17,10194
27441,show by rock,"comedy, music",tv,12,7.17,32061
32038,show by rock ,"comedy, music",tv,12,7.17,8964
2586,soukou kihei votoms kakuyaku taru itan,"drama, mecha, military, sci-fi",ova,5,7.17,1761
1602,soukou no strain,"drama, ecchi, mecha, military, sci-fi, space",tv,13,7.17,14925
2011,taiho shichau zo special,"action, comedy, police, shounen",tv,20,7.17,2856
6312,taiho shichau zo full throttle special,"action, adventure, comedy, police",special,1,7.17,1536
3137,tsurikichi sanpei,"adventure, sports",tv,109,7.17,1650
1922,urusei yatsura movie 3 remember my love,"action, adventure, comedy, drama, romance, sci-fi",movie,1,7.17,2897
30419,wake up girls beyond the bottom,"drama, music",movie,1,7.18,2555
548,wonderful days,"action, drama, romance, sci-fi",movie,1,7.17,23422
31588,all out,"school, seinen, sports",tv,25,7.16,35461
7152,anyamal tantei kiruminzoo,"comedy, magic, shoujo",tv,50,7.16,3605
1051,ao no 6gou,"action, adventure, mecha, military, sci-fi",ova,4,7.16,29487
1554,asatte no houkou,"drama, supernatural",tv,12,7.16,16909
751,bomberman jetters,"action, adventure, comedy, mystery, sci-fi, shounen",tv,52,7.16,1876
34077,cardfight vanguard g next,"action, game, shounen",tv,2,7.16,1363
3432,chou mashin eiyuuden wataru,"action, adventure, comedy, mecha",tv,51,7.16,615
30383,classroomcrisis,"school, sci-fi",tv,13,7.16,55977
2913,daisougen no chiisana tenshi bush baby,"adventure, drama",tv,40,7.16,889
3033,digimon tamers bousou digimon tokkyuu,"adventure, comedy, sci-fi, shounen",movie,1,7.16,14037
1803,dirty pair lovely angels yori ai wo komete,"action, adventure, comedy, police, sci-fi",ova,2,7.16,2038
16385,dog days,"action, adventure, fantasy, magic",tv,12,7.16,34576
1045,elf wo karu monotachi,"adventure, comedy, ecchi, fantasy, magic, shounen",tv,12,7.16,13581
5267,gamba no bouken,"adventure, kids",tv,26,7.16,790
4476,gensoumaden saiyuuki kibou no zaika,"adventure, fantasy",ova,1,7.16,2557
3327,giant gorg,"adventure, mecha, sci-fi",tv,26,7.16,1300
9723,hakuouki hekketsuroku episode 0,"action, drama, harem, historical, josei, samurai, supernatural, vampire",special,1,7.16,8025
1592,hataraki man,"comedy, drama, romance, seinen, slice of life",tv,11,7.16,13681
7728,hellsing psalm of darkness,"action, seinen, supernatural, vampire",special,1,7.16,15097
20673,hinata no aoshigure,"adventure, fantasy, romance",movie,1,7.16,6970
1025,kachou ouji,"adventure, comedy, music, sci-fi, slice of life",tv,13,7.16,16111
2130,kaibutsu oujo,"action, comedy, horror, shounen, supernatural, vampire",tv,25,7.16,44825
33511,korosensei q,"comedy, shounen",movie,1,7.14,13657
1434,lupin iii harimao no zaihou wo oe,"action, adventure, comedy, shounen",special,1,7.16,3057
8097,lupin iii the last job,"adventure, comedy, shounen",special,1,7.16,2685
8666,mazinkaiser skl,"adventure, comedy, mecha, sci-fi, shounen",ova,3,7.16,6941
620,mermaid forest,"drama, fantasy, horror, mystery",tv,13,7.16,14073
7308,mirai shounen conan movie,"adventure, drama, sci-fi",movie,1,7.16,917
2298,mobile suit gundam seed afterphase between the stars,"action, drama, mecha, sci-fi",special,1,7.16,9594
1688,nanatsuirodrops,"magic, romance, school",tv,12,7.16,16604
1209,nasu andalusia no natsu,"action, seinen, sports",movie,1,7.16,4545
2489,onegai my melody,"comedy, fantasy, magic",tv,52,7.16,3633
10108,ore no imouto ga konnani kawaii wake ga nai sd chara ni yoru character commentary,comedy,special,16,7.16,14917
24211,orenchi no furo jijou,"comedy, fantasy, shoujo",tv,13,7.15,47157
325,peach girl,"drama, romance, shoujo, slice of life",tv,25,7.16,49508
1118,pokemon kesshoutou no teiou entei,"action, adventure, comedy, drama, fantasy, kids",movie,1,7.16,73253
23285,poulette no isu,"comedy, kids, slice of life",ona,1,7.16,3675
907,princess princess,"comedy, school, shoujo",tv,12,7.16,38778
23135,pripara,"music, school, shoujo, slice of life",tv,2,7.17,7680
28617,punch line,"comedy, ecchi, sci-fi, super power, supernatural",tv,12,7.16,93000
758,rahxephon pluralitas concentio,"action, drama, mecha, psychological, romance, sci-fi",movie,1,7.16,10524
151,re cutie honey,"action, comedy, ecchi, sci-fi, shoujo ai",ova,3,7.16,10378
917,riding bean,"action, cars, police, seinen",ova,1,7.16,6547
22663,seiken tsukai no world break,"action, fantasy, harem, romance, school, supernatural",tv,12,7.16,97401
6974,seikimatsu occult gakuin,"comedy, mystery, school, sci-fi, supernatural",tv,13,7.16,65021
4021,seiyou kottou yougashiten antique,"comedy, shoujo, shounen ai",tv,12,7.16,21937
5220,shangrila,"action, drama, sci-fi",tv,24,7.16,38495
29027,shinmai maou no testament ova,"action, demons, ecchi, fantasy, harem, romance",ova,1,7.16,33466
10775,sket dance demystifying special,"school, shounen",special,1,7.16,3276
2170,sousei no aquarion ova,"action, mecha, romance, sci-fi, super power, supernatural",ova,2,7.16,7691
876,street fighter ii v,"adventure, drama, mystery, shounen",tv,29,7.16,14002
760,tenjou tenge the past chapter,"adventure, drama, martial arts, romance, shounen, supernatural",movie,1,7.16,15718
31370,tonkatsu dj agetarou,"comedy, music, shounen",tv,12,7.16,6342
343,tsukuyomi moon phase,"comedy, fantasy, romance, seinen, vampire",tv,25,7.16,44874
2300,uchuu no kishi tekkaman blade ova twin blood,"action, mecha, sci-fi, shounen",ova,1,7.16,2432
20449,watashi ga motenai no wa dou kangaetemo omaera ga warui motenaishi nazomeite miru,"comedy, school, slice of life",ova,1,7.16,39779
27655,aldnoahzero 2nd season,"action, mecha, sci-fi, space",tv,12,7.15,149364
9346,battle spirits brave,"action, shounen",tv,50,7.15,1337
17677,buki yo saraba,"action, drama, sci-fi",movie,1,7.15,5078
16157,choujigen game neptune the animation,"action, comedy, fantasy, parody, sci-fi, supernatural",tv,12,7.15,71901
3745,crayon shinchan movie 02 buriburi oukoku no hihou,"comedy, ecchi, kids, school, shounen, slice of life",movie,1,7.15,2073
291,dcss da capo second season,"comedy, drama, harem, romance, supernatural",tv,26,7.15,23364
29437,detective conan happy new year special,"action, comedy, mystery, police, shounen",special,1,7.15,1202
1726,devil may cry,"action, demons, fantasy",tv,12,7.15,166398
2652,doraemon the day when i was born,"comedy, fantasy, kids, sci-fi, shounen",movie,1,7.15,645
2950,doubutsu no mori,"kids, slice of life",movie,1,7.15,12051
2819,dragon quest abel yuusha densetsu,"action, adventure, fantasy, shounen",tv,43,7.15,2104
1046,elf wo karu monotachi ii,"adventure, comedy, fantasy",tv,12,7.15,8004
16982,hayate no gotoku cuties,"comedy, harem, parody, romance, shounen",tv,12,7.15,24044
2799,hello sandybell,"adventure, romance, shoujo",tv,47,7.15,2587
1020,honoo no mirage minagiwa no hangyakusha,"action, drama, historical, romance, shoujo, shounen ai, supernatural",ova,3,7.15,6006
2891,iblard jikan,fantasy,ova,1,7.15,11116
33242,is infinite stratos 2  infinite wedding,unknown,special,1,7.15,6604
29785,jitsu wa watashi wa,"comedy, fantasy, romance, school, shounen, supernatural",tv,13,7.15,88500
11299,keroro gunsou kerozero shupattsudayo zeninshuugou,"action, adventure, comedy, mecha, shounen, space",special,1,7.15,683
3483,maison ikkoku utsuriyuku kisetsu no naka de,"comedy, drama, romance",ova,1,7.15,1458
32030,memories melodies,music,music,1,7.15,699
912,ninku,"adventure, shounen",tv,55,7.15,2424
32013,oshiete galkochan,"comedy, school, slice of life",tv,12,7.15,45778
31378,owari no seraph kyuuketsuki shahar,"action, drama, shounen, supernatural, vampire",ova,1,7.15,17815
1492,project arms,"action, martial arts, super power",tv,26,7.15,6903
2000,roujin z,"comedy, drama, mecha, sci-fi",ova,1,7.15,9358
11441,rurouni kenshin meiji kenkaku romantan  shin kyotohen,"action, drama, historical, samurai, shounen",ova,2,7.15,13795
22877,seirei tsukai no blade dance,"action, comedy, ecchi, fantasy, harem, romance, school, supernatural",tv,12,7.15,124448
8057,shin koihimemusou otome tairan,"adventure, comedy, ecchi, fantasy, historical",tv,12,7.15,13089
2758,shippuu iron leaguer,"sci-fi, shounen, sports",tv,52,7.15,432
29163,sore ga seiyuu,"comedy, slice of life",tv,13,7.15,25707
8250,soukou kihei votoms koei futatabi,"action, drama, mecha, military, sci-fi",ova,1,7.15,1590
3667,strike witches,"action, ecchi, magic, military, sci-fi",tv,12,7.15,96159
2577,tom sawyer no bouken,"adventure, drama, historical, slice of life",tv,49,7.15,2322
3737,usavich,"adventure, comedy",tv,13,7.15,4675
28841,wake up girls seishun no kage,"drama, music",movie,1,7.15,3560
1207,wata no kuni hoshi,"drama, fantasy, psychological, romance, shoujo",movie,1,7.15,1835
48,sign,"adventure, fantasy, game, magic, mystery, sci-fi",tv,26,7.14,110304
7113,30th gundam perfect mission,"mecha, sci-fi",ova,1,7.14,3963
230,air master,"action, comedy, martial arts, seinen",tv,27,7.14,22433
929,aura battler dunbine,"adventure, mecha, sci-fi",tv,49,7.14,3694
32802,cardfight vanguard g stride gatehen,"action, game, shounen",tv,24,7.14,2121
23991,cardfight vanguard movie neon messiah,"action, adventure, demons, game, shounen",movie,1,7.14,2336
8394,cyborg 009 tv,"action, adventure, mecha, sci-fi, shounen",tv,26,7.14,3496
13839,detective conan ova 12 the miracle of excalibur,"comedy, mystery, police, shounen, sports",ova,1,7.14,4947
2355,devilman yochou sirenehen,"demons, horror, sci-fi, supernatural",ova,1,7.14,5858
900,dragon ball z movie 07 kyokugen battle sandai super saiyajin,"adventure, comedy, fantasy, sci-fi, shounen",movie,1,7.14,52690
5152,dragon ball ossu kaettekita son gokuu to nakamatachi,"action, adventure, comedy, fantasy",special,1,7.14,25251
30544,gakusen toshi asterisk,"action, comedy, ecchi, fantasy, harem, romance, school, sci-fi, supernatural",tv,12,7.14,168657
383,galaxy angel,"comedy, sci-fi",tv,24,7.14,17601
4983,hells,"adventure, comedy, horror",movie,1,7.14,9255
475,hotori tada saiwai wo koinegau,"drama, sci-fi",movie,1,7.14,3701
21653,is infinite stratos 2  world purgehen,"action, comedy, harem, mecha, sci-fi",ova,1,7.14,28626
3638,kaiketsu zorori,"adventure, comedy",tv,52,7.14,1034
3616,kamen no maid guy,"action, comedy, ecchi, super power",tv,12,7.14,27761
10372,kamisama dolls,"action, seinen, supernatural",tv,13,7.14,47665
7904,kemono no souja erin soushuuhen,"adventure, drama, fantasy, historical, slice of life",tv,10,7.14,1386
10336,last exile ginyoku no fam,"action, adventure, sci-fi",tv,21,7.14,28616
1659,maiotome specials,"comedy, drama, fantasy, magic",special,9,7.14,4609
1696,murder princess,"action, adventure, fantasy",ova,6,7.14,39377
2151,nils no fushigi na tabi,"adventure, fantasy, kids",tv,52,7.14,2702
5520,onegai my melody sukkiri,"comedy, fantasy, magic",tv,52,7.14,966
2805,onegai samia don,"comedy, fantasy, kids, magic, slice of life",tv,78,7.14,472
524,onegaitwins natsu wa owaranai,"comedy, drama, romance",ova,1,7.14,22614
4742,papa to odorou,comedy,tv,16,7.14,567
6178,pokemon diamond and pearl arceus choukoku no jikuu e,"action, adventure, comedy, drama, fantasy, kids",movie,1,7.14,29668
1709,pokemon mewtwo ware wa koko ni ari,"action, adventure, comedy, drama, fantasy, kids",special,1,7.14,38638
2993,rosario to vampire,"comedy, ecchi, fantasy, harem, romance, school, shounen, vampire",tv,13,7.14,299278
3493,ryuusei no rockman tribe,adventure,tv,21,7.14,3510
4650,seihou bukyou outlaw star pilot,"action, sci-fi, space",special,1,7.14,4046
22687,terra formars,"action, drama, horror, sci-fi, seinen, space",tv,13,7.14,95964
19697,toaru kagaku no railgun s motto marutto railgun,comedy,special,2,7.14,14807
10249,toaru majutsu no indextan ii,"comedy, parody",special,2,7.14,20942
1225,3x3 eyes seima densetsu,"action, adventure, demons, fantasy, horror, romance",ova,3,7.13,8892
58,blue gender,"adventure, drama, horror, mecha, military, romance, sci-fi, space",tv,26,7.13,40581
998,blue seed,"action, adventure, comedy, demons, drama, ecchi, horror, mystery, romance, sci-fi",tv,26,7.13,15194
2561,captain future,"action, adventure, sci-fi, shounen",tv,52,7.13,1837
6202,daisetsusan no yuusha kibaou,"adventure, drama",special,1,7.13,322
2206,galaxy angel z special,"comedy, sci-fi",special,1,7.13,2208
16726,gdgd fairies 2,"comedy, fantasy",tv,12,7.13,1248
1022,generator gawl,"action, adventure, comedy, drama, sci-fi, shounen",tv,12,7.13,5457
4765,gunslinger girl il teatrino ova,"action, drama, military, sci-fi",ova,2,7.13,15785
2997,hi no tori hououhen,"drama, fantasy, historical",movie,1,7.13,1323
8630,hidan no aria,"action, comedy, romance, school",tv,12,7.13,171888
23425,karneval specials,comedy,special,11,7.13,4415
2335,kenyuu densetsu yaiba,"action, comedy, fantasy, martial arts, shounen",tv,52,7.13,5158
2403,kodomo no jikan tv,"comedy, ecchi, school",tv,12,7.13,63348
8876,koe de oshigoto the animation,"comedy, ecchi, seinen",ova,2,7.13,57466
31815,kono danshi mahou ga oshigoto desu,"fantasy, magic, shounen ai",tv,4,7.13,9961
1384,kyuuketsuhime miyu,"action, demons, drama, horror, vampire",ova,4,7.13,11019
1138,medarot,"adventure, comedy, sci-fi, shounen",tv,52,7.13,30148
22071,mikakunin de shinkoukei mite are ga watashitachi no tomatteiru ryokan yo,"comedy, romance, slice of life",special,1,7.13,19538
3656,monochrome factor,"action, shounen ai, supernatural",tv,24,7.13,36517
3136,ochamegami monogatari korokoro pollon,"comedy, magic, parody",tv,46,7.13,1049
9798,pandane to tamagohime,"adventure, fantasy",movie,1,7.13,1995
7695,pokemon diamond and pearl genei no hasha zoroark,"action, adventure, fantasy, kids",movie,1,7.13,24575
10276,prince of tennis mini theater,comedy,special,3,7.13,3010
10819,ranma  tendouke no oyobidenai yatsura,"comedy, martial arts, slice of life",special,1,7.13,2077
12137,roboticarobotics,"psychological, sci-fi, shounen ai, slice of life",ova,1,7.12,5769
1258,saint seiya kamigami no atsuki tatakai,"adventure, sci-fi, shounen",movie,1,7.13,8894
30649,shin atashinchi,"comedy, slice of life",tv,26,7.14,1202
30363,shinmai maou no testament burst,"action, demons, ecchi, fantasy, harem, romance",tv,10,7.13,93293
33433,shuumatsu no izetta,"action, historical, military",tv,12,7.12,74026
2604,sky girls,"mecha, military, sci-fi",tv,26,7.13,17115
12321,thermae romae,"comedy, historical, seinen",tv,3,7.13,13444
6941,toriko jump super anime tour 2009 special,"action, adventure, comedy, shounen, super power",special,1,7.13,4650
961,virtua fighter,"action, adventure, comedy, martial arts, shounen",tv,35,7.13,3875
4773,yamato takeru,"action, adventure, fantasy, magic, mecha, sci-fi, shounen, space",tv,37,7.13,883
4094,batman gotham knight,"action, adventure, martial arts",ova,6,7.12,15958
7366,boku no chikyuu wo mamotte alice kara rinkun e,"drama, romance, sci-fi, shoujo",movie,1,7.12,880
2124,code geass hangyaku no lelouch recaps,"action, mecha, military, school, super power",special,2,7.12,23194
15037,corpse party tortured souls  bougyakusareta tamashii no jukyou,"horror, mystery",ova,4,7.12,126699
5071,croket,"action, adventure, comedy, fantasy",tv,52,7.12,310
10418,deadman wonderland ova,"action, horror, sci-fi",ova,1,7.12,78878
3561,dennou boukenki webdiver,"adventure, mecha, sci-fi, shounen",tv,52,7.12,876
