anime_id,name,genre,type,episodes,rating,members
24873,juuou mujin no fafnir,"fantasy, harem, romance, school",tv,12,6.44,59544
5132,lets nupu nupu,"comedy, ecchi, school",tv,16,6.44,1861
952,magical nyan nyan taruto,"comedy, magic",tv,12,6.44,3693
1880,midnight eye gokuu ii,"action, adventure, mystery, sci-fi, seinen, super power",ova,1,6.44,1688
7171,oni,"demons, historical, supernatural",movie,1,6.44,950
28385,seto no hanayome picture drama,"comedy, parody, romance, school",special,1,6.44,1264
2100,silent mobius 2,"adventure, demons, fantasy, sci-fi, seinen",movie,1,6.44,1624
33205,starfox zero the battle begins,"action, sci-fi, space",ona,1,6.44,1885
8079,tamala 2010 a punk cat in space ova,"dementia, sci-fi",ova,2,6.44,505
6331,ten little gall force,"action, comedy, mecha, military, parody, sci-fi, space",ova,1,6.44,701
4853,tezuka osamu no don dracula,"comedy, horror, supernatural, vampire",tv,8,6.44,934
32881,tiger mask w,"action, drama, shounen, sports",tv,2,6.44,8652
4578,time bokan oudou fukko,"action, comedy, mecha, parody, sci-fi",ova,2,6.44,609
26443,triage x,"action, adventure, ecchi, shounen",tv,10,6.44,59632
6731,ultraman kids no kotowaza monogatari,"comedy, kids, super power",tv,26,6.44,227
2018,warau hyouteki,"horror, mystery",ova,1,6.44,1975
6861,water brain,"dementia, fantasy, sci-fi",special,1,6.44,862
6693,yatterman the movie shin yattermecha osu gou omocha no kuni de dai ketsudan da koron,"comedy, kids",movie,1,6.44,448
31319,12sai 2nd season,"romance, school, shoujo",ova,4,6.43,1383
12967,arcana famiglia,"action, harem, romance, shoujo",tv,12,6.43,106391
4025,asobou hello kitty,"adventure, fantasy, kids",tv,26,6.43,645
4563,bakkyuu hit crash bedaman,adventure,tv,50,6.43,747
2822,bamboo bears,comedy,tv,52,6.43,330
18881,code geass hangyaku no lelouch  kiseki no birthday picture drama flash special,"school, supernatural",special,1,6.43,5005
295,divergence eve 2 misaki chronicles,"adventure, drama, mecha, military, sci-fi, space",tv,13,6.43,4790
29722,eikoku ikka nihon wo taberu,"comedy, slice of life",tv,24,6.43,729
8146,gegege no kitarou daikaijuu,"action, fantasy, horror, shounen, supernatural",movie,1,6.43,305
2697,hispeed jecy,"action, sci-fi",ova,12,6.43,479
4737,himitsukessha taka no tsume,"comedy, parody, super power",tv,12,6.43,341
258,hitsuji no uta,"drama, horror, vampire",ova,4,6.43,10574
10905,ikoku meiro no croise picture drama,"historical, seinen, slice of life",special,6,6.43,2616
5013,juugo shounen hyouryuuki,"adventure, drama, historical",special,1,6.43,305
3858,konchuu monogatari minashigo hutch,"adventure, comedy, drama",tv,91,6.43,1325
31804,kuma miko,"comedy, seinen, slice of life",tv,12,6.43,43176
8302,ladies versus butlers specials,"ecchi, seinen",special,6,6.43,18524
2307,limeiro senkitan nankoku yume roman,"action, comedy, ecchi, mecha",ova,2,6.43,1869
7598,loupsgarous,"mystery, sci-fi, thriller",movie,1,6.43,12350
3571,mach gogogo 1997,"adventure, cars",tv,34,6.43,1545
3881,majokko tickle,"comedy, magic, shoujo",tv,45,6.43,471
2571,mitsubachi maya no bouken,"adventure, comedy, kids",tv,52,6.43,4426
614,okusama wa mahou shoujo,"magic, romance",tv,13,6.43,5098
34252,star beat hoshi no kodou,music,music,1,6.39,230
13563,the four seasons,slice of life,ona,4,6.42,1190
13969,thermae romae x yoyogi animation gakuin collaboration,"comedy, historical, seinen",special,1,6.43,1260
31750,tvban pokemon special masara townhen soushuuhen,"action, adventure, comedy, fantasy, kids",ova,3,6.43,485
11445,ufo princess valkyrie recap,"comedy, romance, sci-fi",special,1,6.44,739
3361,ufo senshi dai apolon,"action, mecha, sci-fi",tv,26,6.43,312
9526,wolf guy,"action, military, sci-fi",ova,6,6.43,412
2024,yoshimune,"comedy, historical",tv,24,6.43,393
33056,buddy go,"comedy, romance, shoujo",special,3,6.42,1415
9591,code geass hangyaku no lelouch r2 flash specials,parody,special,9,6.42,9291
8548,dr slump movie 08 aralechan hoyoyo tasuketa same ni tsurerarete,"comedy, sci-fi, shounen",movie,1,6.42,506
33499,ganbare kickers specials,"drama, shounen, sports",special,2,6.43,141
1868,giniro no olynsis tokito,"adventure, drama, mecha, romance",tv,12,6.42,5305
9389,ginga hyouryuu vifam kieta 12nin,"action, adventure, mecha, sci-fi",ova,1,6.42,205
33024,ginga kikoutai majestic prince mirai e no tsubasa,"action, mecha, school, sci-fi, seinen, space",special,1,6.42,2189
4385,great mazinger tai getter robo,"action, mecha, sci-fi",movie,1,6.42,976
4386,great mazinger tai getter robo g kuuchuu daigekitotsu,"action, mecha, sci-fi",movie,1,6.42,786
5168,hairy tale,"historical, samurai",special,1,6.42,3510
3838,himitsu no akkochan 2,"magic, school, shoujo",tv,61,6.42,375
7017,kon uraon,comedy,special,7,6.42,36560
3278,kinnikuman new york kiki ippatsu,"action, comedy, shounen, sports",movie,1,6.42,278
2260,kiramekiproject,"comedy, ecchi, mecha, sci-fi",ova,5,6.42,1195
4023,kittys paradise,"fantasy, kids",tv,16,6.42,532
31156,kuusen madoushi kouhosei no kyoukan ova,"action, drama, fantasy, magic, school",ova,1,6.42,8632
9691,kyomu senshi miroku,"action, demons, fantasy, historical, samurai, sci-fi, supernatural",ova,6,6.42,207
9792,liccachan fushigi na fushigi na yunia monogatari,"adventure, kids",ova,2,6.42,307
4049,mafukiden pandarian,"adventure, comedy, fantasy, kids, magic, super power",tv,26,6.42,367
349,magical canan,"drama, fantasy, magic, supernatural",tv,13,6.42,2942
31845,masou gakuen hxh,"action, comedy, ecchi, fantasy, harem, romance, school, sci-fi",tv,12,6.42,68025
19257,meganebu,"comedy, school, slice of life",tv,12,6.42,22411
8960,monhun nikki girigiri airou mura airou kiki ippatsu,"action, comedy",tv,10,6.42,787
5006,nagagutsu sanjuushi,"adventure, fantasy, kids",movie,1,6.42,542
9106,nogsaegjeoncha haemosu,"action, adventure, fantasy, shounen",tv,26,6.42,287
9015,obake no holly,"comedy, fantasy, kids, magic",tv,200,6.42,194
25257,persona 4 the animation mr experiment shorts,comedy,special,5,6.42,2196
3819,sasurai no taiyou,"drama, music",tv,26,6.42,316
31540,sekkou boys,"comedy, music",tv,12,6.42,28303
31867,shoujotachi wa kouya wo mezasu ova,school,ova,1,6.42,7194
21119,sister princess re pure characters,"drama, romance",special,12,6.42,544
33668,soushin shoujo matoi,"magic, supernatural",tv,12,6.42,12549
3507,survival,"dementia, drama, music, psychological, school, supernatural",music,1,6.42,2153
18637,tetsuwan atom ivan no wakusei  robot to ningen no yuujou,"action, mecha, sci-fi, shounen, super power",movie,1,6.42,402
8449,togainu no chi,"action, sci-fi, shounen ai",tv,12,6.42,53377
8961,tono to issho ippunkan gekijou,"comedy, samurai, seinen",tv,12,6.42,2321
6127,toradora sos,comedy,special,4,6.42,54096
6234,true tears specials,"comedy, parody, school",special,7,6.42,7296
10405,xi avant,"adventure, sci-fi",movie,1,6.41,2379
12683,yumeyume,music,music,1,6.42,915
5396,yuusha shirei dagwon suishou no hitomi no shounen,mecha,ova,2,6.42,284
17681,zettai bouei leviathan,"comedy, fantasy, magic",tv,13,6.42,18202
3914,1001 nights,"demons, fantasy, romance, seinen",movie,1,6.41,4930
14077,bloodc nonenone gekijou,"comedy, parody",ona,7,6.41,5273
14237,busou shinki,"action, sci-fi, slice of life",tv,12,6.41,24595
33314,digimon universe appli monsters,"action, adventure, comedy, fantasy, kids",tv,2,6.41,3676
23985,futari ecchi 2014,"comedy, ecchi, romance, seinen, slice of life",ova,3,6.41,3479
3015,ginga eiyuu densetsu gaiden ougon no tsubasa,"action, drama, military, sci-fi, shounen, space",movie,1,6.41,6579
1679,green green specials,"comedy, ecchi, romance, slice of life",ova,3,6.41,7526
3022,haai step jun,"action, romance, school, sci-fi",tv,45,6.41,400
4513,hakujaden,"adventure, fantasy, historical, romance",movie,1,6.41,1542
30145,harukanaru toki no naka de hachiyou shou recap,"demons, fantasy, historical, magic, shoujo, supernatural",special,1,6.41,284
4928,idol tenshi youkoso yoko,"comedy, drama, shoujo",tv,43,6.41,419
2422,kenritsu chikyuu boueigun,"action, adventure, comedy, sci-fi, shounen",ova,1,6.41,939
3315,kikou keisatsu metal jack,"action, mecha, police, sci-fi",tv,37,6.41,349
32202,kimi ni maji kyun,"magic, music, romance, school",ova,1,6.42,1801
3276,kinnikuman gyakushuu uchuu kakure choujin,"action, comedy, shounen, sports",movie,1,6.41,287
2162,koutetsu sangokushi,"adventure, historical, shounen",tv,25,6.41,6544
555,koutetsu tenshi kurumi 2,"comedy, mecha, romance, sci-fi, shoujo ai, shounen",tv,12,6.41,8094
1280,mamono hunter youko,"comedy, fantasy, horror, magic, supernatural",ova,6,6.41,6385
32041,mori no densetsu dai ni gakushou,fantasy,movie,1,6.41,251
8896,natsufuku no shoujotachi,"drama, historical",special,1,6.41,347
28963,nekota no koto ga kininatte shikatanai,"school, shoujo",special,1,6.41,612
18639,rinne no lagrange season 2 specials,comedy,special,6,6.41,1599
33192,robot town sagami 2028,drama,ona,1,6.41,386
6979,shukufuku no campanella,"adventure, fantasy, harem, magic",tv,12,6.41,20054
1713,submarine super 99,"action, adventure, military, sci-fi, shounen",tv,13,6.41,684
2027,wind a breath of heart specials,"comedy, romance, school",special,4,6.41,1335
8985,yojouhan shinwa taikei specials,comedy,special,3,6.41,10005
21861,airy me,"dementia, drama, horror, music",music,1,6.4,1561
5112,akikan,"comedy, ecchi, fantasy, romance",tv,12,6.4,74097
6287,akikan kan ippatsu onsen panic,"comedy, ecchi",ova,1,6.4,17949
10526,duel masters zero,"action, kids",tv,25,6.4,795
5375,gakkyuu ou yamazaki,comedy,tv,53,6.4,465
3671,genesis climber mospeada love live alive,"action, mecha, music",ova,1,6.4,712
2474,ginga ojousama densetsu yuna shinen no fairy,"action, adventure, comedy, magic, mecha, sci-fi",ova,3,6.4,1256
16740,hanamaru youchien special preview,"comedy, school",special,1,6.4,1093
22443,hello kitty no alps no shoujo heidi,kids,ova,1,6.4,153
28911,hidamari sketch recap,"comedy, school, slice of life",special,1,6.4,455
28883,hidan no aria aa,"action, school, shoujo ai",tv,12,6.4,39538
360,himikoden,"adventure, drama, fantasy, supernatural",tv,12,6.4,3731
3839,himitsu no akkochan 3,"magic, school, shoujo",tv,44,6.4,378
7729,hokkyoku no muushika miishika,adventure,movie,1,6.4,172
21077,kakumeiki valvrave recaps,"action, mecha",ona,3,6.39,1924
2075,kikochan smile,"adventure, comedy, josei, slice of life",tv,51,6.4,297
2526,kirara,"comedy, ecchi, romance, slice of life, supernatural",ova,1,6.4,1596
19575,kobayashi ga kawai sugite tsurai,"romance, school, shoujo",ova,2,6.4,4251
6227,lovedol lovely idol ova,"comedy, drama, ecchi, harem, music",ova,1,6.4,1135
1503,mahou shoujo pretty sammy specials,"adventure, comedy, fantasy, magic, parody, seinen",special,7,6.4,798
1580,mouryou senki madara,"adventure, demons, shounen, supernatural",ova,2,6.4,813
749,nanamichan,"comedy, kids",tv,12,6.4,828
13681,nekogami yaoyorozu specials,"comedy, seinen, supernatural",special,7,6.4,915
19731,osamu to musashi,"adventure, fantasy, kids",movie,1,6.4,143
3768,play ball,"action, shounen, sports",tv,13,6.4,413
980,rikujou boueitai maochan,"comedy, kids, magic, military, sci-fi",tv,26,6.4,2934
11049,shin maple town monogatari palm townhen  konnichiwa atarashii machi,"fantasy, slice of life",movie,1,6.4,185
1500,teizokurei daydream,"comedy, drama, ecchi, horror, supernatural",ova,4,6.4,5305
10594,tokimeki tonight recaps,"comedy, fantasy, romance, shoujo, vampire",special,2,6.4,220
33247,tsubasa to hotaru 2016,"romance, school, shoujo",special,3,6.4,1411
9566,umi kara no shisha,"action, mecha, sci-fi, super power",movie,1,6.4,826
30751,usavich zero,comedy,tv,13,6.4,619
4420,vampiyan kids pilot,"action, comedy, kids, vampire",special,1,6.4,435
4591,yoiko,"comedy, school, slice of life",tv,20,6.4,2238
1583,0091,"action, mecha, sci-fi, seinen",tv,12,6.39,11097
26189,ai tenshi densetsu wedding peach specials,"adventure, comedy, magic, romance, shoujo",special,2,6.39,446
15085,amnesia,"fantasy, josei, mystery, romance",tv,12,6.39,134349
7779,andersen monogatari tv,"drama, fantasy, kids",tv,52,6.39,389
7752,bao lian deng,"action, adventure, fantasy",movie,1,6.39,225
34173,buddy go 2,"comedy, romance, shoujo",special,4,6.39,304
14277,chitose get you,"comedy, romance, school, seinen, slice of life",tv,26,6.39,12886
22733,dragon collection,"fantasy, shounen",tv,51,6.39,3229
6062,duel masters movie 2 lunatic god saga,"action, adventure, comedy, shounen",movie,1,6.39,522
32785,future card buddyfight ddd,game,tv,2,6.39,912
8157,gegege no kitarou youkai tokkyuu maboroshi no kisha,"adventure, comedy, fantasy, horror, supernatural",movie,1,6.39,241
3906,h p lovecrafts the dunwich horror and other stories,horror,ova,1,6.39,1704
2281,jikuu tantei genshikun,"adventure, comedy, fantasy, mystery, sci-fi, shounen",tv,39,6.39,5541
9748,kaze wo nuke,sports,ova,1,6.39,187
7505,knyacki,"comedy, drama, fantasy, kids",ona,2,6.38,242
1591,kujibikiunbalance,"comedy, romance, school",tv,12,6.39,9021
10755,lupin tai holmes,mystery,special,1,6.39,331
3475,muramasa,"historical, horror, martial arts, samurai",movie,1,6.39,2535
15881,oniichan dakedo ai sae areba kankeinai yo ne specials,"comedy, ecchi",special,6,6.39,16618
31927,phantom of the kill zero kara no hangyaku,"action, adventure, fantasy",movie,1,6.39,4893
25365,pokemon xy koukoku no princess diancie,"comedy, fantasy, kids",special,1,6.4,2829
8840,senkou no night raid yogen,"action, historical, military, super power",special,1,6.39,2752
23433,shin strange,"comedy, shoujo, slice of life",tv,12,6.39,9385
25883,taisei kensetsu vietnam noi bai kuukou,drama,special,1,6.39,2258
2679,teki wa kaizoku nekotachi no kyouen,"comedy, sci-fi",ova,6,6.39,720
4533,uchuu kazoku carlvinson,"comedy, fantasy, sci-fi",ova,1,6.39,649
9100,umi monogatari marin no kore naani,comedy,special,4,6.39,1229
8249,votoms finder,"action, drama, mecha, military, sci-fi",ova,1,6.39,1735
12123,yurumates 3d,"comedy, seinen, slice of life",tv,13,6.39,5678
6094,a piece of phantasmagoria,"fantasy, kids",ova,15,6.38,1862
13859,accel world acchel world,"comedy, sci-fi",special,8,6.38,26190
17167,akai koudan zillion specials,"adventure, sci-fi, shounen",special,3,6.38,262
2789,bdensetsu battle bedaman,"adventure, fantasy, kids, shounen",tv,52,6.38,6545
2156,bakugan battle brawlers,"action, fantasy, game",tv,52,6.38,25846
301,cinderella boy,"action, adventure, comedy, mystery",tv,13,6.38,3246
13807,corpse party missing footage,"horror, school",ova,1,6.38,57507
29165,daitoshokan no hitsujikai picture drama,"comedy, ecchi",special,6,6.38,2487
32264,dear brave,"music, romance",music,1,6.38,522
1337,dororon enmakun,"comedy, demons, fantasy, horror, shounen, supernatural",tv,25,6.38,1898
1344,eightman after,"action, drama, sci-fi",ova,4,6.38,1771
24675,future card buddyfight recap,game,special,1,6.38,277
16912,gdgd fairies 2 episode 0,"comedy, fantasy",special,1,6.38,367
6271,gendai kibunroku kaii monogatari,horror,ova,1,6.38,704
581,honoo no labyrinth,"adventure, comedy, ecchi, samurai",ova,2,6.38,5958
2523,izumo takeki tsurugi no senki,"adventure, drama, fantasy, martial arts, romance, supernatural",tv,12,6.38,7748
10132,jin sheng yuan,music,music,1,6.38,406
7170,kataku,"demons, historical, supernatural",movie,1,6.38,1025
23341,mahouka koukou no rettousei yoku wakaru mahouka,"comedy, magic",ona,6,6.38,13068
15717,nagareboshi lens specials,"romance, shoujo",special,3,6.38,1557
19351,nijiiroprism girl,"comedy, romance, school, shoujo",ova,4,6.38,1390
9731,nurarihyon no mago recaps,"action, demons, shounen, supernatural",special,2,6.38,9781
1547,obake no qtarou,"comedy, school, slice of life, supernatural",tv,96,6.38,250
29511,ongaku shoujo,"music, slice of life",movie,1,6.38,6289
3004,saint beast ikusen no hiru to yoruhen,"fantasy, magic",ova,2,6.38,2708
1508,scifi harry,"drama, horror, sci-fi",tv,20,6.38,5194
5693,shinransama negai soshite hikari,historical,ova,1,6.38,150
13175,shiranpuri movie,"drama, school",movie,1,6.38,3104
6437,sora wo kakeru shoujo picture drama,"adventure, comedy, sci-fi, space",special,9,6.38,1716
3724,taiko no tatsujin,game,tv,26,6.38,406
8214,tekkamen wo oe dartagnan monogatari yori,"action, historical",special,1,6.38,349
3512,tenshi nanka ja nai,"comedy, drama",ova,1,6.38,2027
927,transformers superlink,"adventure, mecha, sci-fi, shounen",tv,51,6.38,2691
2700,uchuu kaizoku mito no daibouken futari no joousama,"action, comedy, sci-fi",tv,13,6.38,585
30385,valkyrie drive mermaid,"action, ecchi, fantasy, shoujo ai",tv,12,6.38,45400
30445,wake up girls deai no kiroku a brief recording,music,ova,1,6.39,810
21595,yugioh zexal second iza saishuu kessen e special,"action, fantasy, game, shounen",special,1,6.38,1172
28593,yuusha ni narenakatta ore wa shibushibu shuushoku wo ketsui shimashita specials,comedy,special,5,6.38,3818
454,gift,"comedy, fantasy, game",ova,1,6.37,15411
791,arion,"action, adventure, drama, fantasy, magic, seinen",movie,1,6.37,2415
12581,asa made jugyou chu,"comedy, ecchi, romance, school",ova,1,6.37,25285
9165,attack no1 namida no kaiten receive,"drama, shoujo, sports",movie,1,6.37,248
4509,captain future kareinaru taiyokei race,"action, adventure, sci-fi",special,1,6.37,394
9935,chocolat no mahou,"drama, magic, shoujo, supernatural",ova,13,6.37,3800
4014,choujin locke lord leon,"action, sci-fi, super power",ova,3,6.37,483
2760,densetsu kyojin ideon sesshokuhen,"drama, mecha, sci-fi, space",movie,1,6.37,1740
4443,duel masters charge,"action, adventure, comedy, shounen",tv,52,6.37,2827
10524,duel masters victory,"action, adventure, comedy, shounen",tv,52,6.37,574
4298,futari no joe,"shounen, sports",ova,6,6.37,461
8149,gegege no kitarou 1968 movie,"adventure, comedy, fantasy, horror, supernatural",movie,1,6.37,346
8533,hana no kage,"demons, drama, historical, romance",ona,1,6.37,987
3175,kaitei choutokkyuu marine express,"action, adventure, comedy, drama, sci-fi",special,1,6.37,551
32503,kemeko deluxe izumichan fukenkou yo kari,ecchi,special,1,6.37,372
16149,kickheart,"comedy, romance, sports",movie,1,6.37,8007
17791,kyoto animation ikitaku naru omisehen,sci-fi,special,1,6.37,2708
23897,lovely movie itoshi no muco,slice of life,tv,20,6.37,503
28179,miss monochrome the animation  manager,"comedy, music, slice of life",ova,1,6.37,3808
32233,mitchirineko march,music,music,1,6.37,126
4614,moero arthur hakuba no ouji,"adventure, drama, historical, romance",tv,22,6.37,267
9290,moyashimon cgi anime,"comedy, school, supernatural",ova,1,6.37,1415
7108,shikabane hime puchitto,comedy,special,1,6.37,3377
835,sister princess re pure,"drama, romance",tv,13,6.37,5782
2714,sotsugyou graduation,"drama, school",ova,2,6.37,548
8042,taishou yakyuu musume specials,"school, sports",special,2,6.37,907
8011,time bokan series gyakuten ippatsuman,"action, comedy, mecha, sci-fi",tv,58,6.37,334
5344,time bokan series itadakiman,mecha,tv,20,6.37,298
2103,toy,"drama, music, shounen",ova,1,6.37,1275
6276,umezu kazuo no noroi,horror,ova,1,6.37,2361
11699,yurumates wa,"comedy, seinen, slice of life",ova,1,6.37,1747
25833,zephyr,"drama, music",special,1,6.37,1478
33964,91 days recap,"action, drama, historical",special,1,6.35,9453
14007,akai shouzou char soshite frontal e,"drama, mecha, military, sci-fi, shounen, space",special,1,6.36,686
5098,andersen monogatari,"drama, fantasy, kids",movie,1,6.36,364
1380,blue gender the warrior,"adventure, drama, horror, mecha, military, romance, sci-fi, space",movie,1,6.36,7197
2885,ganbare goemon,"comedy, shounen",tv,23,6.36,713
20187,genei wo kakeru taiyou fumikomenai kokoro,magic,special,1,6.36,4545
5652,glass no kantai la legende du vent de lunivers specials,"adventure, sci-fi",special,2,6.36,1005
13215,guskou budori no denki 2012,"drama, fantasy, kids, slice of life",movie,1,6.36,2936
2739,highschool aurabuster hikari no mezame,"drama, fantasy, super power",ova,3,6.36,347
3834,hoshi no ko chobin,"adventure, sci-fi",tv,26,6.36,231
10832,ikoku meiro no croise yune and alice,"historical, seinen, slice of life",special,7,6.36,3409
28713,isuca gokuraku,"comedy, ecchi, romance, seinen, supernatural",ova,1,6.36,9464
2609,kakyuusei 1999,"drama, harem, romance, school",tv,14,6.36,1578
1777,kaze no tairiku,"action, adventure, fantasy, supernatural",movie,1,6.36,2552
2155,kono aozora ni yakusoku wo youkoso tsugumi ryou e,"harem, romance, school",tv,13,6.36,12622
19401,kuusou no sora tobu kikaitachi,historical,movie,1,6.36,651
10562,machine hayabusa,"action, cars, shounen, sports",tv,21,6.36,227
499,makai toshi shinjuku,"adventure, horror, romance, shounen, supernatural",ova,1,6.36,7293
1832,meiou project zeorymer,"action, drama, mecha, psychological, sci-fi",ova,4,6.36,2504
9254,mianhada saranghanda,drama,movie,1,6.36,969
337,psychic academy,"comedy, romance, supernatural",tv,24,6.36,7751
18413,puchitto gargantia,"mecha, sci-fi",ona,13,6.36,7170
32308,rilu rilu fairilu yousei no door,"fantasy, magic",tv,2,6.36,1293
9424,seupideuwang beongae,"action, game, school, shounen, sports",tv,26,6.36,226
22231,tenshi no shippo chu shoushuuhen tenshi no utagoe,"fantasy, magic, romance",ova,1,6.36,289
13843,wild adapter,"action, drama, mystery, shoujo",ova,2,6.36,5196
15313,wooser no sono higurashi,"comedy, fantasy, slice of life",tv,12,6.36,8081
2840,youkoso lodosstou e,"comedy, parody",movie,1,6.36,1156
8812,alice sos,adventure,tv,28,6.35,734
24531,ane log moyako neesan no tomaranai monologue,"comedy, ecchi, school, shounen",ova,3,6.35,9588
20365,another misaki mei  shizuka ni,music,music,1,6.36,10775
10194,badaui jeonseol jangbogo,"action, adventure, comedy, mystery",tv,26,6.35,371
25839,bonjourkoiaji ptisserie,"comedy, harem, romance, shoujo, slice of life",ona,24,6.35,22127
6872,cyborg 009,"action, adventure, drama, sci-fi, shounen",movie,1,6.35,1216
6628,dengeki bunko 2007 movie festival special,comedy,special,1,6.35,2793
8491,digimon savers 3d digital world kiki ippatsu,"action, adventure, fantasy, kids, supernatural",movie,1,6.35,3720
21997,duel masters victory v,"action, adventure, comedy, shounen",tv,51,6.35,363
9880,esper mami hoshizora no dancing doll,"fantasy, shounen",movie,1,6.35,236
8584,future war 198xnen,"drama, military",movie,1,6.35,444
3215,fuyu no hi,historical,movie,1,6.35,2380
2423,grey digital target,"action, fantasy, sci-fi",movie,1,6.35,1052
1977,hijikata toshizou shiro no kiseki,"action, drama, historical, samurai",ova,1,6.35,1965
7230,hoshi ni negai wo cold body  warm heart,"adventure, sci-fi",ona,1,6.35,1217
848,jinkiextend ova,"mecha, sci-fi",ova,1,6.35,1985
577,kagihime monogatari eikyuu alice rinbukyoku,"fantasy, magic",tv,13,6.35,5623
3214,kosukesama rikimarusama konpeitou no ryuu,"action, adventure, super power",ova,1,6.35,437
14247,lunn wa kaze no naka,"drama, romance",ova,1,6.35,403
2059,mainichi ga nichiyoubi,"comedy, romance",ova,6,6.35,735
15565,makenki two,"action, ecchi, harem, martial arts, school, super power",tv,10,6.35,49842
31923,mini hama minimum hamatora movies,"comedy, mystery, school, super power",movie,2,6.35,833
9523,minori scramble,comedy,ova,1,6.35,2208
5585,new dream hunter rem yume no kishitachi,"ecchi, magic",ova,1,6.35,586
4024,sanrio anime sekai meisaku gekijou,"adventure, fantasy, kids",tv,13,6.35,611
2406,sazaesan,"comedy, slice of life",tv,2,6.35,1632
19573,short peace opening,"fantasy, sci-fi, supernatural",special,1,6.35,2790
10349,suzys zoo daisuki witzy,kids,tv,25,6.35,369
30585,taifuu no noruda,"drama, school, sci-fi, supernatural",movie,1,6.35,14281
4451,tanin no kankei,"comedy, ecchi, romance, school",ova,2,6.35,868
17959,tetsuwan atom atom tanjou no himitsu,"drama, mecha, sci-fi",movie,1,6.35,342
5475,time bokan 2000 kaitou kiramekiman,"action, adventure, comedy, mecha, sci-fi",tv,26,6.35,305
12867,tsuki no sango,drama,movie,1,6.35,1661
2566,uchuujin tanaka tarou,"comedy, school, shounen",tv,24,6.35,386
6822,ukkari pnlope 2009,"comedy, slice of life",tv,26,6.35,317
3290,vampiyan kids,"comedy, fantasy, kids",tv,23,6.35,435
8240,wanpaku oomukashi kum kum,"adventure, comedy, historical, kids",tv,26,6.35,229
547,wind a breath of heart ova,"drama, romance, school, supernatural",ova,3,6.35,2043
1630,yousei hime ren,"adventure, comedy, fantasy",ova,2,6.35,2253
9595,amanatsu,sci-fi,movie,1,6.34,1305
27619,ane log moyako neesan no honpen wo tobidashite tomaranai monologue,"comedy, ecchi, romance, shounen, slice of life",ova,6,6.34,2866
10901,aoi hitomi no onnanoko no ohanashi,"drama, historical",special,1,6.34,373
2309,azusa otetsudai shimasu,"comedy, sci-fi, slice of life, sports",ova,1,6.34,1973
2023,bakuen campus guardress,"action, comedy, school, shounen, supernatural",ova,4,6.34,1491
6920,blade,"action, drama, horror, vampire",tv,12,6.34,14100
693,burn up scramble,"action, comedy, drama, ecchi, police, sci-fi, shounen",tv,12,6.34,5899
6645,chuu bra,"comedy, ecchi, school",tv,12,6.34,32470
17205,cowboy bebop ein no natsuyasumi,adventure,special,1,6.34,9456
8550,dr slump movie 10 arale no bikkuriman,"comedy, sci-fi, shounen",movie,1,6.34,513
14073,ebiten kouritsu ebisugawa koukou tenmonbu,"comedy, ecchi, parody, school, shounen",ona,10,6.34,16438
6557,fortune quest yo ni mo shiawase na boukenshatachi,"adventure, comedy, fantasy, magic",ova,4,6.34,464
8178,fujoshi no hinkaku,slice of life,ova,1,6.34,633
5862,fumoon,sci-fi,special,1,6.34,354
20929,galo sengen,music,music,1,6.34,586
33498,ganbare kickers hitoribocchi no ace striker,"drama, shounen, sports",special,1,6.34,145
8150,gegege no kitarou chisougan,"adventure, comedy, fantasy, horror, supernatural",movie,1,6.34,188
7596,haiyoru nyaruani,"comedy, parody, sci-fi",ova,9,6.34,18386
1850,haou daikei ryuu knight adeu legend ii,"action, adventure, fantasy, mecha",ova,3,6.34,430
30155,hoshi no kirby tokubetsuhen  taose koukaku majuu ebizou,"action, adventure, comedy, fantasy",special,1,6.34,384
12579,itsuka tenma no kuro usagi picture drama,"comedy, ecchi, romance, shounen, supernatural, vampire",special,6,6.34,3463
31762,king of prism by pretty rhythm,"music, shoujo, sports",movie,1,6.34,2897
8141,konchuu monogatari mitsubachi hutch yuuki no melody,"adventure, comedy, drama",movie,1,6.34,233
6994,koneko no studio,comedy,movie,1,6.34,373
